cluster_id,cluster_size,medoid,medoid_explain,label_existing,label_proposed,member_explains
71,53,f1262118,#_Hospital_with_Psychiatric_Geriatric_Service,,"Hospital Rehabilitation, Geriatric and Support Services",#_Hospital_with_Psychiatric_Geriatric_Service; #_Hospital_with_Geriatric_Services; #_Hospital_with_Physical_Rehabilitation_Outpatient_Service; #_Rehabilitation_State_Hospital; #_Rehabilitation_Long_Term_Hospital; #_Hospital_with_Alcohol_Chemical_Dependent_Outpatient_Service; #_Hospital_with_Neurological_Services; #_Hospital_with_Supportive_Housing_Service; #_Hospital_with_Physical_Rehabilitation_Care; #_Hospital_with_Social_Work_Services; #_Hospital_with_Patient_Representative_Services; #_Hospital_with_Palliative_Care_Program; #_Hospital_with_Assisted_Living; #_Hospital_with_Assistive_Technology_Center; Population_in_Group_Homes_for_Adults; #_Hospital_with_Teen_Outreach_Services; #_Hospital_with_Inpatient_Palliative_Creek_Unit; #_Hospital_with_Oncology_Services; #_Hospital_with_Volunteer_Service_Department; #_Hospital_with_Alcohol_Drug_Abuse_Inpatient_Care
72,15,f0479318,Public_Health_Total,,Public Health Physician Workforce,Public_Health_Total; Public_Health_Patient_Care_Office_Based; Public_Health_Patient_Care_Hospital_Full_Time_Staff; Public_Health_<_35; Public_Health_35_44; Public_Health_45_54; Public_Health_55_64; Public_Health_Administration; Public_Health_Teaching; Public_Health_Other; Public_Health_Total_Patient_Care; Public_Health_Research; Public_Health_65_74; Public_Health_75_+; Public_Health_Patient_Care_Hospital_Resident
73,15,f0982818,Emergency_Medical_Medicine_Patient_Care_Office_Based,,Emergency Medicine Physician Workforce,Emergency_Medical_Medicine_Total; Emergency_Medical_Medicine_Patient_Care_Office_Based; Emergency_Medical_Medicine_Patient_Care_Hospital_Full_Time_Staff; Emergency_Medical_Medicine_Administration; Emergency_Medical_Medicine_Teaching; Emergency_Medical_Medicine_Other; Emergency_Medical_Medicine_Total_Patient_Care; Emergency_Medical_Medicine_Research; Emergency_Medical_Medicine_Patient_Care_Hospital_Resident; Emergency_Medicine_<_35; Emergency_Medicine_35_44; Emergency_Medicine_45_54; Emergency_Medicine_55_64; Emergency_Medicine_65_74; Emergency_Medicine_75_+
74,57,f1403518,#_Hospital_with_Hospitalists_Care,,Hospital Acute Care Capacity and Utilization,#_Hospital_with_Hospitalists_Care; Hospital_Admissions; #_Critical_Access_Hospitals; #_Operating_Rooms; Emergency_Department_Visits; Outpatient_Visits_in_State_Non_General_Hospital; #_Critical_Access_State_General_Hospital; Outpatient_Visits_in_State_General_Hospital; #_Hospital_with_Pediatric_Intensive_Care; Hospital_Beds; #_Hospital_with_Other_Intensive_Care; #_Hospital_with_Urgent_Care_Center; #_Hospital_with_Ambulatory_Surgery_Center; #_Ambulatory_Surgery_Centers; #_Hospital_with_Medical_Surgical_Intensive_Care; #_Hospital_with_Patient_Education_Center; #_Hospital_with_Indigent_Care_Clinic; #_Hospital_with_Freestandng_Outpatient_Center; #_Hospital_with_Residency_Training; #_Hospital_with_Ambulance_Services
75,62,f1474618,Doctors_of_Osteopathic_Medicine_Other_Specialty_Total,,Osteopathic Physician Workforce by Specialty,Doctors_of_Osteopathic_Medicine_Other_Specialty_Total; Doctors_of_Osteopathic_Medicine_Other_Specialty_Total_Patient_Care; Doctors_of_Osteopathic_Medicine_General_Practice_Total; Doctors_of_Osteopathic_Medicine_General_Practice_Total_Patient_Care; Doctors_of_Osteopathic_Medicine_Family_Medical_Medicine_General_Total; Doctors_of_Osteopathic_Medicine_Family_Medical_Medicine_General_Total_Patient_Care; Doctors_of_Osteopathic_Medicine_Family_Medical_Medicine_Subspecialty_Total; Doctors_of_Osteopathic_Medicine_Primary_Care_Hospital_Resident; Doctors_of_Osteopathic_Medicine_Family_Medical_Medicine_Subspecialties_Total_Patient_Care; Doctors_of_Osteopathic_Medicine_General_Internal_Medical_Medicine_Total; Doctors_of_Osteopathic_Medicine_General_Internal_Medical_Medicine_Total_Patient_Care; Doctors_of_Osteopathic_Medicine_Internal_Medicine_Subspecialties_Total_Patient_Care; Doctors_of_Osteopathic_Medicine_Internal_Medical_Medicine_Subspecialties_Total; Doctors_of_Osteopathic_Medicine_Total_Patient_Care_Hospital_Resident; Doctors_of_Osteopathic_Medicine_Total_Patient_Care_Hospital_Full_Time_Staff; Doctors_of_Osteopathic_Medicine_Total_Other_Professional_Activity; Doctors_of_Osteopathic_Medicine_Primary_Care_Patient_Care; Doctors_of_Osteopathic_Medicine_Inactive_Total; Doctors_of_Osteopathic_Medicine_Inactive_Male; Doctors_of_Osteopathic_Medicine_Inactive_Female
76,18,f1109318,General_Internal_Medical_Medicine_Total_Patient_Care,,General Internal Medicine Physician Workforce,General_Internal_Medical_Medicine_Total_Patient_Care; General_Internal_Medical_Medicine_Research; General_Internal_Medical_Medicine_Total; General_Internal_Medical_Medicine_Patient_Care_Office_Based; General_Internal_Medical_Medicine_Patient_Care_Hospital_Full_Time_Staff; General_Internal_Medical_Medicine_Administration; General_Internal_Medical_Medicine_Teaching; General_Internal_Medical_Medicine_Other; General_Internal_Medical_Medicine_Patient_Care_Hospital_Residents; General_Internal_Medical_Medicine_Other_Professional_Active; General_Internal_Medical_Medicine_<_35; General_Internal_Medical_Medicine_35_44; General_Internal_Medical_Medicine_45_54; General_Internal_Medical_Medicine_55_64; General_Internal_Medical_Medicine_65_74; General_Internal_Medical_Medicine_75_+; General_Internal_Medical_Medicine_Patient_Care_Hospital_Resident
77,15,f0478818,General_Prevention_Medical_Medicine_Total,,General Preventive Medicine Physician Workforce,General_Prevention_Medical_Medicine_Total; General_Prevention_Medical_Medicine_Patient_Care_Office_Based; General_Prevention_Medical_Medicine_Patient_Care_Hospital_Full_Time_Staff; General_Prevention_Medical_Medicine_Administration; General_Prevention_Medical_Medicine_Teaching; General_Prevention_Medical_Medicine_Other; General_Prevention_Medical_Medicine_Total_Patient_Care; General_Prevention_Medical_Medicine_Research; General_Prevention_Medical_Medicine_Patient_Care_Hospital_Resident; General_Preventive_Medical_Medicine_<_35; General_Preventive_Medical_Medicine_35_44; General_Preventive_Medical_Medicine_45_54; General_Preventive_Medical_Medicine_55_64; General_Preventive_Medical_Medicine_65_74; General_Preventive_Medical_Medicine_75_+
78,33,f0461018,Medical_Doctors_Total_General_Practice_Total,,General Practice Medical Doctor Workforce,Medical_Doctors_Total_General_Practice_Total; Medical_Doctors_Total_General_Practice_Patient_Care_Hospital_Full_Time_Staff; Medical_Doctors_Total_General_Practice_Administration; Medical_Doctors_Total_General_Practice_Teaching; Medical_Doctors_Total_General_Practice_Other; Medical_Doctors_Total_General_Practice_<_35; Medical_Doctors_Total_General_Practice_35_44; Medical_Doctors_Total_General_Practice_45_54; Medical_Doctors_Total_General_Practice_55_64; Medical_Doctors_Total_General_Practice_Patient_Care_Office_Based; Medical_Doctors_Total_General_Practice_Total_Patient_Care; Medical_Doctors_Total_General_Practice_Research; Medical_Doctors_Total_General_Practice_Patient_Care_Hospital_Resident; Medical_Doctors_Total_General_Practice_Other_Professional_Active; Medical_Doctors_Total_General_Practice_65_74; Medical_Doctors_Total_General_Practice_75_+; Medical_Doctors_General_Practice_Total; Medical_Doctors_General_Practice_Patient_Care_Office_Based; Medical_Doctors_General_Practice_Patient_Care_Hospital_Resident; Medical_Doctors_General_Practice_Patient_Care_Hospital_Full_Time_Staff
79,16,f0481818,Medical_Doctors_Inactive_Total,,Inactive and Unclassified Medical Doctors,Medical_Doctors_Inactive_Total; Medical_Doctors_Inactive_Male; Medical_Doctors_Inactive_Female; Medical_Doctors_Inactive_<_35; Medical_Doctors_Inactive_35_44; Medical_Doctors_Inactive_45_54; Medical_Doctors_Inactive_55_64; Medical_Doctors_Inactive_65_74; Medical_Doctors_Inactive_75_+; Medical_Doctors_Not_Classified_Total; Medical_Doctors_Not_Classified_<_35; Medical_Doctors_Not_Classified_35_44; Medical_Doctors_Not_Classified_45_54; Medical_Doctors_Not_Classified_55_64; Medical_Doctors_Not_Classified_65_74; Medical_Doctors_Not_Classified_75_+
80,15,f1172418,Internal_Medical_Medicine_Subspecialties_Total,,Internal Medicine Subspecialties Workforce,Internal_Medical_Medicine_Subspecialties_Total; Internal_Medical_Medicine_Subspecialties_Total_Patient_Care; Internal_Medical_Medicine_Subspecialties_Patient_Care_Office_Based; Internal_Medical_Medicine_Subspecialties_Patient_Care_Hospital_Full_Time_Staff; Internal_Medical_Medicine_Subspecialties_Administration; Internal_Medical_Medicine_Subspecialties_Teaching; Internal_Medical_Medicine_Subspecialties_Research; Internal_Medical_Medicine_Subspecialties_Other; Internal_Medical_Medicine_Subspecialties_<_35; Internal_Medical_Medicine_Subspecialties_35_44; Internal_Medical_Medicine_Subspecialties_45_54; Internal_Medical_Medicine_Subspecialties_55_64; Internal_Medical_Medicine_Subspecialties_65_74; Internal_Medical_Medicine_Subspecialties_75_+; Internal_Medical_Medicine_Subspecialties_Patient_Care_Hospital_Resident
81,15,f0461818,Medical_Medicine_Specialty_Total_Total,,Medical Specialty Physician Totals,Medical_Medicine_Specialty_Total_Total; Medical_Medicine_Specialty_Total_Patient_Care_Hospital_Full_Time_Staff; Medical_Medicine_Specialty_Total_Administration; Medical_Medicine_Specialty_Total_Teaching; Medical_Medicine_Specialty_Total_Other; Medical_Medicine_Specialty_Total_Patient_Care_Office_Based; Medical_Medicine_Specialty_Total_Total_Patient_Care; Medical_Medicine_Specialty_Total_Research; Medical_Medicine_Specialty_Total_Patient_Care_Hospital_Resident; Medical_Specialty_Total_<_35; Medical_Specialty_Total_35_44; Medical_Specialty_Total_45_54; Medical_Specialty_Total_55_64; Medical_Specialty_Total_65_74; Medical_Specialty_Total_75_+
82,28,f1200618,Medical_Doctors_Family_Medical_Medicine_Subspecialty_Total,,Family Medicine Physician Workforce,Medical_Doctors_Family_Medical_Medicine_Subspecialty_Total; Medical_Doctors_Family_Medical_Medicine_Subspecialties_Total_Patient_Care; Medical_Doctors_Family_Medical_Medicine_Subspecialties_Patient_Care_Office_Based; Medical_Doctors_Family_Medical_Medicine_Subspecialties_Administration; Medical_Doctors_Family_Medical_Medicine_Subspecialties_Teaching; Medical_Doctors_Family_Medical_Medicine_Subspecialties_Research; Medical_Doctors_Family_Medical_Medicine_Subspecialties_Other; Medical_Doctors_Family_Medical_Medicine_Subspecialties_Patient_Care_Hospital_Resident; Medical_Doctors_Family_Medical_Medicine_General_Total; Medical_Doctors_Family_Medical_Medicine_General_Total_Patient_Care; Medical_Doctors_Family_Medical_Medicine_General_Patient_Care_Office_Based; Medical_Doctors_Family_Medical_Medicine_General_Administratn; Medical_Doctors_Family_Medical_Medicine_General_Teaching; Medical_Doctors_Family_Medical_Medicine_General_Research; Medical_Doctors_Family_Medical_Medicine_General_Other; Medical_Doctors_Family_Medical_Medicine_General_<_35; Medical_Doctors_Family_Medical_Medicine_General_35_44; Medical_Doctors_Family_Medical_Medicine_General_45_54; Medical_Doctors_Family_Medical_Medicine_General_55_64; Medical_Doctors_Family_Medical_Medicine_General_65_74
83,26,f1467818,Medical_Doctors_Primary_Care_Hospital_Resident,,Primary Care Physicians by Graduate Origin and Setting,Medical_Doctors_Primary_Care_Hospital_Resident; Medical_Doctors_Total_Patient_Care_Total_Graduates; Physician_Total_Patient_Care_International_Medical_Graduate_Graduated; Medical_Doctors_Total_Patient_Care_United_States_Graduates; Medical_Doctors_Total_Patient_Care_International_Medical_Graduate_Graduated; Medical_Doctors_Family_Medical_Medicine_Subspecialties_Hospital_Full_Time_Staff; Medical_Doctors_Family_Medical_Medicine_General_Hospital_Full_Time_Staff; Medical_Doctors_Primary_Care_Patient_Care; Physician_Primary_Care_Hospital_Resident; Medical_Doctors_Total_Hospital_Based_Patient_Care_Non_Federal; Medical_Doctors_Total_Patient_Care_Canadian_Graduated; Physician_Total_Patient_Care_Total_Graduates; Physician_Medical_Medicine_Rehabilitation_Patient_Care_Office_Base; Physician_Total_Patient_Care_United_States_Graduates; Physician_Primary_Care_Patient_Care; Physician_Total_Patient_Care_Canadian_Graduated; #_Hospital_with_General_Medical_Medicine_Surgical_Care_Adult; #_Hospital_with_General_Medical_Medicine_Surgical_Care_Pediatric; #_Hospital_with_Medical_School_Affiliation; #_General_Medical_Surgical_Long_Term_Hospital
84,36,f1168418,Obstetrics_Gynecology_General_Total,,Obstetrics and Gynecology Physician Workforce,Obstetrics_Gynecology_General_Total; Obstetrics_Gynecology_General_Total_Patient_Care; Obstetrics_Gynecology_General_Patient_Care_Office_Based; Obstetrics_Gynecology_General_Patient_Care_Hospital_Full_Time_Staff; Obstetrics_Gynecology_General_Administration; Obstetrics_Gynecology_General_Teaching; Obstetrics_Gynecology_General_Research; Obstetrics_Gynecology_General_Other; Obstetrics_Gynecology_Subspecialties_Total; Obstetrics_Gynecology_Subspecialties_Total_Patient_Care; Obstetrics_Gynecology_Subspecialties_Patient_Care_Office_Based; Obstetrics_Gynecology_Subspecialties_Patient_Care_Hospital_Full_Time_Staff; Obstetrics_Gynecology_Subspecialties_Administration; Obstetrics_Gynecology_Subspecialties_Teaching; Obstetrics_Gynecology_Subspecialties_Research; Obstetrics_Gynecology_Subspecialties_Other; Obstetrics_Gynecology_General_Patient_Care_Hospital_Residents; Obstetrics_Gynecology_General_Other_Professional_Activity; Obstetrics_Gynecology_Subspecialties_Patient_Care_Hospital_Resident; Obstetrics_Gynecology_Subspecialties_Other_Professional_Active
85,15,f1171418,Pediatric_Subspecialties_Total,,Pediatric Subspecialties Physician Workforce,Pediatric_Subspecialties_Total; Pediatric_Subspecialties_Total_Patient_Care; Pediatric_Subspecialties_Patient_Care_Office_Based; Pediatric_Subspecialties_Patient_Care_Hospital_Full_Time_Staff; Pediatric_Subspecialties_Administration; Pediatric_Subspecialties_Teaching; Pediatric_Subspecialties_Research; Pediatric_Subspecialties_Other; Pediatric_Subspecialties_<_35; Pediatric_Subspecialties_35_44; Pediatric_Subspecialties_45_54; Pediatric_Subspecialties_55_64; Pediatric_Subspecialties_65_74; Pediatric_Subspecialties_75_+; Pediatric_Subspecialties_Patient_Care_Hospital_Resident
86,18,f1170418,Pediatrics_General_Total,,General Pediatrics Physician Workforce,Pediatrics_General_Total; Pediatrics_General_Total_Patient_Care; Pediatrics_General_Patient_Care_Office_Based; Pediatrics_General_Patient_Care_Hospital_Full_Time_Staff; Pediatrics_General_Administration; Pediatrics_General_Teaching; Pediatrics_General_Research; Pediatrics_General_Other; Pediatrics_General_Patient_Care_Hospital_Resident; Pediatrics_General_Other_Professional_Active; Pediatrics_General_<_35; Pediatrics_General_35_44; Pediatrics_General_45_54; Pediatrics_General_55_64; Pediatrics_General_65_74; Pediatrics_General_75_+
87,33,f0473018,Other_Specialty_Total_Total,,Other Specialty Physician Counts,Other_Specialty_Total_Total; Other_Specialty_Total_Patient_Care_Hospital_Full_Time_Staff; Other_Specialty_Total_Administration; Other_Specialty_Total_Teaching; Other_Specialty_Total_Other; Other_Specialty_Total_<_35; Other_Specialty_Total_35_44; Other_Specialty_Total_45_54; Other_Specialty_Total_55_64; Other_Specialty_Total_Patient_Care_Office_Based; Other_Specialty_Total; Other_Specialty_Patient_Care_Office_Based; Other_Specialty_Patient_Care_Hospital_Full_Time_Staff; Other_Specialty_Administration; Other_Specialty_Teaching; Other_Specialty_Other; Other_Specialty_<_35; Other_Specialty_35_44; Other_Specialty_45_54; Other_Specialty_55_64
88,21,f1365018,Transplant_Surgical_Total,,Transplant Surgery Workforce and Hospital Services,Transplant_Surgical_Total; Transplant_Surgical_Total_Patient_Care; Transplant_Surgical_Patient_Care_Office_Based; Transplant_Surgical_Patient_Care_Hospital_Resident; Transplant_Surgical_Patient_Care_Hospital_Full_Time_Staff; Transplant_Surgical_Administration; Transplant_Surgical_Teaching; Transplant_Surgical_Research; Transplant_Surgical_Other; Transplantation_Surgery_<_35; Transplantation_Surgery_35_44; Transplantation_Surgery_45_54; Transplantation_Surgery_55_64; Transplantation_Surgery_65_74; Transplantation_Surgery_75_+; #_Hospital_with_Tissue_Transplant; #_Hospital_with_Kidney_Transplant; #_Hospital_with_Heart_Transplant; #_Hospital_with_Lung_Transplant; #_Hospital_with_Liver_Transplant
89,15,f0471018,Plastic_Surgical_Total,,Plastic Surgery Physician Workforce,Plastic_Surgical_Total; Plastic_Surgical_Patient_Care_Office_Based; Plastic_Surgical_Patient_Care_Hospital_Full_Time_Staff; Plastic_Surgical_Administration; Plastic_Surgical_Teaching; Plastic_Surgical_Other; Plastic_Surgical_Total_Patient_Care; Plastic_Surgical_Research; Plastic_Surgical_Patient_Care_Hospital_Resident; Plastic_Surgery_<_35; Plastic_Surgery_35_44; Plastic_Surgery_45_54; Plastic_Surgery_55_64; Plastic_Surgery_65_74; Plastic_Surgery_75_+
90,18,f0470018,Orthopedic_Surgical_Total,,Orthopedic Surgery Workforce and Hospital Services,Orthopedic_Surgical_Total; Orthopedic_Surgical_Patient_Care_Office_Based; Orthopedic_Surgical_Patient_Care_Hospital_Full_Time_Staff; Orthopedic_Surgical_Administration; Orthopedic_Surgical_Teaching; Orthopedic_Surgical_Other; Orthopedic_Surgical_Total_Patient_Care; Orthopedic_Surgical_Research; Orthopedic_Surgical_Patient_Care_Hospital_Resident; Orthopedic_Surgery_<_35; Orthopedic_Surgery_35_44; Orthopedic_Surgery_45_54; Orthopedic_Surgery_55_64; Orthopedic_Surgery_65_74; Orthopedic_Surgery_75_+; #_Hospital_with_Orthopedic_Services; #_Hospital_with_Computer_Assistant_Orthopedic_Surgical; #_Hospital_with_Prosthetic_&_Orthotic_Service
91,18,f0468018,General_Surgical_Total,,General Surgery Physician Workforce,General_Surgical_Total; General_Surgical_Patient_Care_Office_Based; General_Surgical_Patient_Care_Hospital_Full_Time_Staff; General_Surgical_Administration; General_Surgical_Teaching; General_Surgical_Other; General_Surgical_Total_Patient_Care; General_Surgical_Research; General_Surgical_Patient_Care_Hospital_Residents; General_Surgical_Other_Professional_Activity; General_Surgery_<_35; General_Surgery_35_44; General_Surgery_45_54; General_Surgery_55_64; General_Surgery_65_74; General_Surgery_75_+
92,27,f0467118,Surgical_Specialty_Total_Total,,"Surgical Specialties, Operations and Operating Capacity",Surgical_Specialty_Total_Total; Surgical_Specialty_Total_Patient_Care_Hospital_Full_Time_Staff; Surgical_Specialty_Total_Administration; Surgical_Specialty_Total_Teaching; Surgical_Specialty_Total_Other; Surgical_Specialty_Total_<_35; Surgical_Specialty_Total_35_44; Surgical_Specialty_Total_45_54; Surgical_Specialty_Total_55_64; Surgical_Specialty_Total_Patient_Care_Office_Based; Surgical_Specialty_Total_Total_Patient_Care; Surgical_Specialty_Total_Research; Surgical_Specialty_Total_65_74; Surgical_Specialty_Total_75_+; Surgical_Specialty_Total_Patient_Care_Hospital_Resident; #_Surgical_Operations_Total; Other_Surgical_Patient_Care_Hospital_Residents; Other_Surgical_Patient_Care_Hospital_Full_Time_Staff; Other_Surgical_Other_Professional_Activity; #_Surgical_Operations_Inpatient
93,15,f0472018,Thoracic_Surgical_Total,,Thoracic Surgery Physician Workforce,Thoracic_Surgical_Total; Thoracic_Surgical_Patient_Care_Office_Based; Thoracic_Surgical_Patient_Care_Hospital_Full_Time_Staff; Thoracic_Surgical_Administration; Thoracic_Surgical_Teaching; Thoracic_Surgical_Other; Thoracic_Surgical_Total_Patient_Care; Thoracic_Surgical_Research; Thoracic_Surgical_Patient_Care_Hospital_Resident; Thoracic_Surgery_<_35; Thoracic_Surgery_35_44; Thoracic_Surgery_45_54; Thoracic_Surgery_55_64; Thoracic_Surgery_65_74; Thoracic_Surgery_75_+
94,15,f0466618,Pulmonary_Disease_Total,,Pulmonary Disease Physician Workforce,Pulmonary_Disease_Total; Pulmonary_Disease_Patient_Care_Office_Based; Pulmonary_Disease_Patient_Care_Hospital_Full_Time_Staff; Pulmonary_Disease_Administration; Pulmonary_Disease_Teaching; Pulmonary_Disease_Other; Pulmonary_Disease_Total_Patient_Care; Pulmonary_Disease_Research; Pulmonary_Disease_Patient_Care_Hospital_Resident; Pulmonary_Diseases_<_35; Pulmonary_Diseases_35_44; Pulmonary_Diseases_45_54; Pulmonary_Diseases_55_64; Pulmonary_Diseases_65_74; Pulmonary_Diseases_75_+
95,25,f0496418,Pediatric_Cardiology_<_35,,Pediatric Cardiology Workforce and Cardiac Hospital Services,Pediatric_Cardiology_<_35; Pediatric_Cardiology_35_44; Pediatric_Cardiology_45_54; Pediatric_Cardiology_55_64; Pediatric_Cardiology_65_74; Pediatric_Cardiology_75_+; Pediatric_Cardiolgy_Total; Pediatric_Cardiolgy_Patient_Care_Office_Based; Pediatric_Cardiolgy_Patient_Care_Hospital_Full_Time_Staff; Pediatric_Cardiolgy_Administration; Pediatric_Cardiolgy_Teaching; Pediatric_Cardiolgy_Other; Pediatric_Cardiolgy_Total_Patient_Care; Pediatric_Cardiolgy_Research; Pediatric_Cardiolgy_Patient_Care_Hospital_Resident; #_Hospital_with_Pediatric_Cardiac_Surgery; #_Hospital_with_Pediatric_Cardiology_Services; #_Hospital_with_Pediatric_Cardiac_Electrophysiology; #_Hospital_with_Adult_Cardiac_Surgery; #Hispanic_with_Pediatric_Intervntnl_Cardiac_Catheterization
96,15,f1363518,Vascular_Medical_Medicine_Total,,Vascular Medicine Physician Workforce,Vascular_Medical_Medicine_Total; Vascular_Medical_Medicine_Total_Patient_Care; Vascular_Medical_Medicine_Patient_Care_Office_Based; Vascular_Medical_Medicine_Patient_Care_Hospital_Resident; Vascular_Medical_Medicine_Patient_Care_Hospital_Full_Time_Staff; Vascular_Medical_Medicine_Administration; Vascular_Medical_Medicine_Teaching; Vascular_Medical_Medicine_Research; Vascular_Medical_Medicine_Other; Vascular_Medicine_<_35; Vascular_Medicine_35_44; Vascular_Medicine_45_54; Vascular_Medicine_55_64; Vascular_Medicine_65_74; Vascular_Medicine_75_+
97,15,f0463118,Cardiovas_Disease_Total,,Cardiovascular Disease Physician Workforce,Cardiovas_Disease_Total; Cardiovas_Disease_Patient_Care_Office_Based; Cardiovas_Disease_Patient_Care_Hospital_Full_Time_Staff; Cardiovas_Disease_Administration; Cardiovas_Disease_Teaching; Cardiovas_Disease_Other; Cardiovas_Disease_Total_Patient_Care; Cardiovas_Disease_Research; Cardiovas_Disease_Patient_Care_Hospital_Resident; Cardiovascular_Diseases_<_35; Cardiovascular_Diseases_35_44; Cardiovascular_Diseases_45_54; Cardiovascular_Diseases_55_64; Cardiovascular_Diseases_65_74; Cardiovascular_Diseases_75_+
98,15,f0477818,Pathology_Anatomic_Clinical_Anatomical_Clinic_Total,,Anatomic and Clinical Pathology Workforce,Pathology_Anatomic_Clinical_Anatomical_Clinic_Total; Pathology_Anatomic_Clinical_Anatomical_Clinic_Patient_Care_Office_Based; Pathology_Anatomic_Clinical_Anatomical_Clinic_Patient_Care_Hospital_Full_Time_Staff; Pathology_Anatomic_Clinical_Anatomical_Clinic_Administration; Pathology_Anatomic_Clinical_Anatomical_Clinic_Teaching; Pathology_Anatomic_Clinical_Anatomical_Clinic_Other; Pathology_Anatomic_Clinical_Anatomical_Clinic_Total_Patient_Care; Pathology_Anatomic_Clinical_Anatomical_Clinic_Research; Pathology_Anatomic_Clinical_Anatomical_Clinic_Patient_Care_Hospital_Resident; Pathology_Anatomical_Clinic_<_35; Pathology_Anatomical_Clinic_35_44; Pathology_Anatomical_Clinic_45_54; Pathology_Anatomical_Clinic_55_64; Pathology_Anatomical_Clinic_65_74; Pathology_Anatomical_Clinic_75_+
99,15,f0475818,Forensic_Pathology_Anatomic_Clinical_Total,,Forensic Pathology Physician Workforce,Forensic_Pathology_Anatomic_Clinical_Total; Forensic_Pathology_Anatomic_Clinical_Patient_Care_Office_Based; Forensic_Pathology_Anatomic_Clinical_Patient_Care_Hospital_Full_Time_Staff; Forensic_Pathology_Anatomic_Clinical_Administration; Forensic_Pathology_Anatomic_Clinical_Teaching; Forensic_Pathology_Anatomic_Clinical_Other; Forensic_Pathology_Anatomic_Clinical_Total_Patient_Care; Forensic_Pathology_Anatomic_Clinical_Research; Forensic_Pathology_Anatomic_Clinical_Patient_Care_Hospital_Resident; Forensic_Pathology_<_35; Forensic_Pathology_35_44; Forensic_Pathology_45_54; Forensic_Pathology_55_64; Forensic_Pathology_65_74; Forensic_Pathology_75_+
100,24,f1400518,#Hispanic_with_Electronic_Beam_Computed_Tomography,,Hospital Advanced Imaging and Radiation Services,#Hispanic_with_Electronic_Beam_Computed_Tomography; #_Hospital_with_Positron_Emission_Emission_Tomography_Computed_Tomography; #_Hospital_with_Magnetic_Resonance_Imaging; #_Hospital_with_Image_guided_Radiation_Therapy; #_Hospital_with_Endoscopic_Ultrasound; #_Hospital_with_Intraoperative_Magnetic_Resonance_Imaging; #Hispanic_with_Multislice_Spanish_Combined_Tomography_<64; #Hispanic_with_Multislice_Spanish_Combined_Tomography_64+; #_Hospital_with_Positron_Emission_Emission_Tomography; #_Hospital_with_Diagnostic_Radioisotope_Facility; #_Hospital_with_Single_Photon_Emission_Tomography; #_Hospital_with_Full_field_Digital_Mammography; #_Hospital_with_Stereotactic_Radiosurgery; #_Hospital_with_Optical_Colonoscopy; #_Hospital_with_Ultrasound; #_Hospital_with_Endoscopic_Retrograde_Cholangiopancreatography; #_Hospital_with_Breast_Cancer_Screen_Mammography; #_Hospital_with_Proton_Therapy; #_Hospital_with_Virtual_Colonoscopy; #_Hospital_with_Ablation_of_Barrett's_Esophageal
101,30,f0475318,Diagnostic_Radiology_Total,,Diagnostic Radiology Physician Workforce,Diagnostic_Radiology_Total; Diagnostic_Radiology_Patient_Care_Office_Based; Diagnostic_Radiology_Patient_Care_Hospital_Full_Time_Staff; Diagnostic_Radiology_<_35; Diagnostic_Radiology_35_44; Diagnostic_Radiology_45_54; Diagnostic_Radiology_55_64; Radiology_Total; Radiology_Patient_Care_Office_Based; Radiology_Patient_Care_Hospital_Full_Time_Staff; Diagnostic_Radiology_Administration; Diagnostic_Radiology_Teaching; Diagnostic_Radiology_Other; Radiology_Administration; Radiology_Teaching; Radiology_Other; Radiology_<_35; Radiology_35_44; Radiology_45_54; Radiology_55_64
